24-04-16 16:41:12	acara pam ukt psht tulungagung selesai, situasi bertahan kondusif tka untuk selanjutnya anggota sqr beserta anggota polsek jajaran membantu pengawalan kepulangan dari adik-adik psht menuju rayon\/ranting masing-masing.\n#polrestulungagung #sabharapoldajatim #sabhara #polisi_indonesia #polisiindonesia #tulungagung #polri #police #polisi #poldajatim #indonesianpolice
24-04-16 16:36:09	bapak kabagops polres tulungagung memberikan arahan kepada siswa psht selesai melaksanakan tes kenaikan sabuk di padepokan psht tulungagung.\n#indonesianpolice #sabharapoldajatim #sabhara #polisi #police #tulungagung #polri #psht #1922 #police #polisi #poldajatim #polisiindonesia #polisi_indonesia #sabhara #sabharapoldajatim #polrestulungagung
24-04-16 16:28:22	anggota sqr yang sedang melaksanakan pam kenaikan sabuk psht bersama anggota polsek jajaran membaur bersama warga dari persaudaraan setia hati terate, dari sini dapat diambil hikmahnya bahwa polisi adalah mitra masyarakat, meliputi segala elemen & pencak silat yang merupakan warisan dari nenek moyang, asli dari indonesia yang harus dilestarikan sebagai pribumi yang bermartabat. kalau bukan kita siapa lagi? intinya semua itu bermuara pada terciptanya suatu kedamaian, karena jika kita saling merangkul maka kita akan menjadi kuat. maka sinergitas antara polri dengan semua elemen harus sinkron dengan baik, dan ini adalah wujud nyata.\n#polrestulungagung #psht #polisi_indonesia #polisiindonesia #poldajatim #1922 #polri #police #polisi #sabhara #sabharapoldajatim #indonesianpolice #pshttulungagung
24-04-16 07:23:36	anggota sabhara melaksanakan apel kesiapan pam ukt (ujian kenaikan tingkat) persaudaraan setia hati terate cabang tulungagung di mapolsek kalangbret pada minggu pagi ini.\n#sabhara #indonesianpolice #tulungagung #police #polri #polisi #poldajatim #polisiindonesia #polisi_indonesia #psht #polrestulungagung
23-04-16 19:46:08	pam kegiatan karnaval hiburan bertempat pasar pahing oleh anggota sabhara, salah satu bintang tamu yang akan mengisi pada acara malam hari ini adalah d'masiv.\n#polrestulungagung #polisiindonesia #poldajatim #polisi #police #tulungagung #indonesianpolice #sabhara #dmasiv
23-04-16 10:10:14	aksi mahasiswa pmii melakukan kerja bakti bertempat di kali ngrowo situasi tka.\n#indonesianpolice #unras #sabharapoldajatim #sabhara #tulungagung #polri #police #polisi #poldajatim #polisiindonesia #polrestulungagung
23-04-16 10:03:43	pam demo pmii di depan gedung dprd dalam rangka mayday situasi tka.\n#tulungagung #polrestulungagung #polisi_indonesia #polisiindonesia #poldajatim #sabhara #sabharapoldajatim #mayday #unras #indonesianpolice
23-04-16 10:01:25	patroli piket wisma agung 1 oleh anggota sqr bergabung dengan anggota peleton penjagaan. (220416)\n#polisipoldajatim #sabhara #indonesianpolice #tulungagung #polri #police #polisi #poldajatim #polisiindonesia #polisi_indonesia #polrestulungagung #patroli
22-04-16 08:04:57	olahraga pagi anggota sabhara polres tulungagung, jogging pagi di seputaran dalam kota\n#semerupolice #polisipoldajatim #tulungagung #polrestulungagung #polisiindonesia #indonesianpolice #sabhara #jumatsehat #polisipoldajatim
21-04-16 15:27:52	anggota sqr melaksanakan pengamanan lokasi ditemukannya bahan peledak di dam boyolangu berupa granat, sementara dari jibom sedang melakukan penjinakan terhadap granat tersebut untuk dievakuasi dan diselidiki lebih lanjut.\n#polisi #police #sabharapoldajatim #patroli #polri #sabhara #jibom #indonesianpolice #tulungagung #polrestulungagung
21-04-16 14:01:34	penemuan diduga handak dengan tkp timur dam boyolangu.\n#polrestulungagung #tulungagung #semerupolice #polisi_indonesia #polri #patroli #sabharapoldajatim #police #polisi
21-04-16 13:37:55	press release hasil operasi bersinar semeru 2016 polres tulungagung\n#indonesianpolice #polisiindonesia #polri #police #polisi #poldajatim #polisiindonesia #polisi_indonesia #semerupolice #opsbersinar2016 #tulungagung #polrestulungagung
